userid,roomtypes,amenities
1,"executive, suite, vip","air conditioning, bathrobes, blackout curtains, carpeting, closet, clothes rack, coffeetea maker, daily housekeeping, desk, dvdcd player, fan, free bottled water, free wi-fi in all rooms, hair dryer, heating, ironing facilities, laptop safe box, linens, minibar, mirror, safebox, satellitecable, seating area, shower, slippers, smoke detector, sofa, soundproofing, telephone, toiletries, towels, wake-up service, whirlpool bathtub, woodenparqueted flooring"
2,"double, family","additional bathroom, air conditioning, alarm clock, bathrobes, carpeting, cleaning products, closet, clothes dryer, clothes rack, coffeetea maker, desk, dressing room, extra long bed, fan, free bottled water, free wi-fi in all rooms, full kitchen, hair dryer, heating, high chair, interconnecting rooms, ironing facilities, kitchenware, linens, microwave, minibar, mirror, mosquito net, private entrance, refrigerator, safebox, satellitecable, seating area, separate dining area, slippers, smoke detector, sofa, soundproofing, telephone, toiletries, towels, trouser press, wake-up service, woodenparqueted flooring"
3,"apartment, single, standard","additional bathroom, air conditioning, alarm clock, bathrobes, carpeting, cleaning products, closet, clothes dryer, clothes rack, coffeetea maker, desk, dressing room, fan, free bottled water, free wi-fi in all rooms, full kitchen, hair dryer, heating, high chair, ironing facilities, kitchenware, laptop safe box, linens, minibar, mirror, mosquito net, private entrance, refrigerator, safebox, satellitecable, seating area, separate dining area, slippers, smoke detector, sofa, soundproofing, telephone, toiletries, towels, trouser press, wake-up service, woodenparqueted flooring"
4,"double, single","air conditioning, blackout curtains, carpeting, closet, coffeetea maker, desk, fan, free bottled water, free wi-fi in all rooms, hair dryer, heating, ironing facilities, linens, minibar, safebox, satellitecable, seating area, sewing kit, shoeshine kit, smoke detector, sofa, soundproofing, telephone, toiletries, towels, wake-up service, woodenparqueted flooring"
5,"double, family","additional toilet, air conditioning, blackout curtains, carpeting, cleaning products, closet, coffeetea maker, daily housekeeping, dart board, desk, extra long bed, fan, free bottled water, free wi-fi in all rooms, hair dryer, heating, ironing facilities, laptop safe box, linens, minibar, mirror, on-demand movies, safebox, satellitecable, seating area, smoke detector, soundproofing, telephone, toiletries, towels, trouser press, wake-up service"